word,pronunciation,meaning,word_type,example,topic
fill up / /fɪl/ /ʌp,,Lấp đầy,v,The bus filled up within minutes. (Chiếc xe buýt đầy người chỉ trong vài phút),Chủ đề: Giao thông & Du lịch
jam-packed / /dʒæm/ /pækt,,Đông người,adj,The station was jam-packed during rush hour. (Nhà ga đông nghịt người vào giờ cao điểm),Chủ đề: Giao thông & Du lịch
rush hour / /rʌʃ/ /aʊər,,Giờ cao điểm,n,We avoid driving during rush hour. (Chúng tôi tránh lái xe vào giờ cao điểm),Chủ đề: Giao thông & Du lịch
electric mini-bus / /iˈlek.trɪk/ /ˈmɪn.i.bʌs,,Xe buýt mini chạy điện,n,The electric mini-bus is environmentally friendly. (Xe buýt mini chạy điện thân thiện với môi trường),Chủ đề: Giao thông & Du lịch
carpooling,/ˈkɑːˌpuː.lɪŋ/,Hình thức đi chung xe,n,Carpooling helps reduce traffic and pollution. (Đi chung xe giúp giảm giao thông và ô nhiễm),Chủ đề: Giao thông & Du lịch
tranquillity,/træŋˈkwɪləti/,Sự yên bình,n,I enjoy the tranquillity of the countryside. (Tôi thích sự yên bình của vùng quê),Chủ đề: Giao thông & Du lịch
rat race / /ræt/ /reɪs,,Cuộc sống xô bồ,n,He left the rat race to live a simpler life. (Anh ấy rời khỏi cuộc sống xô bồ để sống đơn giản hơn),Chủ đề: Giao thông & Du lịch
recharge my battery / /ˌriːˈtʃɑːdʒ/ /maɪ/ /ˈbætri,,Nạp lại năng lượng,v,I need a short vacation to recharge my battery. (Tôi cần một kỳ nghỉ ngắn để nạp lại năng lượng),Chủ đề: Giao thông & Du lịch
worth-living city / /wɜːθ/ /ˈlɪvɪŋ/ /ˈsɪti,,Thành phố đáng sống,n,Da Nang is known as a worth-living city. (Đà Nẵng được biết đến là một thành phố đáng sống),Chủ đề: Giao thông & Du lịch
local cuisine / /ˈləʊkl/ /kwɪˈziːn,,Ẩm thực địa phương,n,We tried the local cuisine during our trip. (Chúng tôi đã thử ẩm thực địa phương trong chuyến đi),Chủ đề: Giao thông & Du lịch
tourist attraction / /ˈtʊərɪst/ /əˈtrækʃn,,Địa điểm thu hút khách du lịch,n,Ha Long Bay is a famous tourist attraction. (Vịnh Hạ Long là một địa điểm du lịch nổi tiếng),Chủ đề: Giao thông & Du lịch
breath-taking,/ˈbreθteɪkɪŋ/,Đẹp đến nghẹt thở,adj,The mountain view was absolutely breath-taking. (Khung cảnh núi non đẹp đến nghẹt thở),Chủ đề: Giao thông & Du lịch
aerial walkway / /ˈeəriəl/ /ˈwɔːkweɪ,,Cầu đi bộ trên cao,n,The aerial walkway offers a unique view of the city. (Cầu đi bộ trên cao mang đến một góc nhìn độc đáo của thành phố),Chủ đề: Giao thông & Du lịch
coastal city / /ˈkəʊstl/ /ˈsɪti,,Thành phố biển,n,Nha Trang is a well-known coastal city. (Nha Trang là một thành phố biển nổi tiếng),Chủ đề: Giao thông & Du lịch
superb,/suːˈpɜːb/,Tuyệt hảo,adj,The food was superb and worth every penny. (Món ăn tuyệt hảo và rất đáng tiền),Chủ đề: Giao thông & Du lịch
local specialty / /ˈləʊkl/ /ˈspeʃəlti,,Đặc sản địa phương,n,Banh mi is a popular local specialty in Vietnam. (Bánh mì là một đặc sản địa phương phổ biến ở Việt Nam),Chủ đề: Giao thông & Du lịch
it would be a miss (not to),,Sẽ thật phí (nếu không),phr,It would be a miss not to visit the museum. (Sẽ thật phí nếu không ghé thăm bảo tàng),Chủ đề: Giao thông & Du lịch
blast,/blɑːst/,Một sự kiện rất vui vẻ,n,The party was a blast last night. (Bữa tiệc tối qua rất vui),Chủ đề: Giao thông & Du lịch
unexpected expenses / /ˌʌnɪkˈspektɪd/ /ɪkˈspensɪz,,Chi phí phát sinh,n,Travelers should prepare for unexpected expenses. (Người đi du lịch nên chuẩn bị cho các chi phí phát sinh),Chủ đề: Giao thông & Du lịch
cost-effective / /ˌkɒst/ /ɪˈfektɪv,,Tiết kiệm chi phí,adj,Public transport is a cost-effective option. (Giao thông công cộng là lựa chọn tiết kiệm chi phí),Chủ đề: Giao thông & Du lịch
pick up groceries / /pɪk/ /ʌp/ /ˈɡrəʊsəriz,,Mua đồ tạp hoá,v,I need to pick up groceries after work. (Tôi cần mua đồ tạp hoá sau giờ làm),Chủ đề: Tiền bạc & Mua sắm
flea market / /fliː/ /ˈmɑːkɪt,,Chợ hàng thùng,n,We found many vintage items at the flea market. (Chúng tôi tìm được nhiều đồ cổ ở chợ hàng thùng),Chủ đề: Tiền bạc & Mua sắm
get some great deals / /ɡet/ /sʌm/ /ɡreɪt/ /diːlz,,Mua được đồ giá rẻ,v,You can get some great deals during the sale. (Bạn có thể mua được đồ giá rẻ trong đợt giảm giá),Chủ đề: Tiền bạc & Mua sắm
without breaking the bank / /wɪˈðaʊt/ /breɪk/ /ðə/ /bæŋk,,Không mất nhiều tiền,adv,We enjoyed a nice meal without breaking the bank. (Chúng tôi thưởng thức một bữa ngon mà không tốn nhiều tiền),Chủ đề: Tiền bạc & Mua sắm
in the vicinity of / /ɪn/ /ðiː/ /vɪˈsɪn.ə.ti/ /əv,,Gần,adv,There is a supermarket in the vicinity of my house. (Có một siêu thị gần nhà tôi),Chủ đề: Tiền bạc & Mua sắm
excellent craftsmanship / /ˈeksələnt/ /ˈkrɑːftsmənʃɪp,,Sự khéo léo,tay nghề cao,n,Chủ đề: Tiền bạc & Mua sắm
mass production / /mæs/ /prəˈdʌk.ʃən,,Sản xuất hàng loạt,n,Mass production reduces the cost of goods. (Sản xuất hàng loạt giúp giảm giá thành sản phẩm),Chủ đề: Tiền bạc & Mua sắm
hit the shop / /hɪt/ /ðə/ /ʃɒp,,Đến cửa hàng,v,Let’s hit the shop before it closes. (Đi đến cửa hàng trước khi nó đóng cửa),Chủ đề: Tiền bạc & Mua sắm
treat oneself / /triːt/ /wʌnˈself,,Tự thưởng cho bản thân,v,She treated herself to a new dress. (Cô ấy tự thưởng cho mình một chiếc váy mới),Chủ đề: Tiền bạc & Mua sắm
independent store / /ɪn.dɪˈpen.dənt/ /stɔːr,,Cửa hàng riêng lẻ,n,I prefer buying from independent stores. (Tôi thích mua hàng từ các cửa hàng riêng lẻ),Chủ đề: Tiền bạc & Mua sắm
brick-and-mortar shop / /brɪk/ /ænd/ /ˈmɔː.tər/ /ʃɒp,,Cửa hàng thật,n,Brick-and-mortar shops are still popular despite online shopping. (Cửa hàng thật vẫn phổ biến dù mua sắm online phát triển),Chủ đề: Tiền bạc & Mua sắm
saving,/ˈseɪ.vɪŋ/,Khoản tiết kiệm,n,He used his savings to buy a new laptop. (Anh ấy dùng khoản tiết kiệm để mua laptop),Chủ đề: Tiền bạc & Mua sắm
down payment / /daʊn/ /ˈpeɪ.mənt,,Tiền đặt cọc,n,They made a down payment on a new car. (Họ đặt cọc để mua chiếc xe mới),Chủ đề: Tiền bạc & Mua sắm
healthcare service / /ˈhelθ.keər/ /ˈsɜː.vɪs,,Dịch vụ chăm sóc sức khỏe,n,Healthcare services are improving every year. (Dịch vụ chăm sóc sức khỏe được cải thiện mỗi năm),Chủ đề: Tiền bạc & Mua sắm
overspend,/əʊ.vəˈspend/,Tiêu quá số tiền đang có,v,You shouldn’t overspend on unnecessary items. (Bạn không nên tiêu quá nhiều cho những thứ không cần thiết),Chủ đề: Tiền bạc & Mua sắm
payday,/ˈpeɪ.deɪ/,Ngày được trả lương,n,Everyone is excited on payday. (Ai cũng háo hức vào ngày nhận lương),Chủ đề: Tiền bạc & Mua sắm
piggy bank / /ˈpɪɡ.i/ /bæŋk,,Lợn tiết kiệm,n,Children often save coins in a piggy bank. (Trẻ em thường tiết kiệm tiền xu trong lợn tiết kiệm),Chủ đề: Tiền bạc & Mua sắm
set saving goals / /set/ /ˈseɪ.vɪŋ/ /ɡəʊlz,,Đặt mục tiêu tiết kiệm,v,You should set saving goals to manage your money. (Bạn nên đặt mục tiêu tiết kiệm để quản lý tiền bạc),Chủ đề: Tiền bạc & Mua sắm
withdraw,/wɪðˈdrɔː/,Rút tiền,v,He withdrew cash from the ATM. (Anh ấy rút tiền từ cây ATM),Chủ đề: Tiền bạc & Mua sắm
financial decision / /ˈfaɪ.næns/ /dɪˈsɪʒ.ən,,Quyết định tài chính,n,Buying a house is a major financial decision. (Mua nhà là một quyết định tài chính lớn),Chủ đề: Tiền bạc & Mua sắm
smart investment / /smɑːt/ /ɪnˈvest.mənt,,Đầu tư thông minh,n,Real estate can be a smart investment. (Bất động sản có thể là một khoản đầu tư thông minh),Chủ đề: Tiền bạc & Mua sắm
balance the expense / /ˈbæl.əns/ /ðiː/ /ɪkˈspens,,Cân bằng chi tiêu,v,Families must balance their expenses carefully. (Các gia đình phải cân bằng chi tiêu cẩn thận),Chủ đề: Tiền bạc & Mua sắm
cut down on (st) / /kʌt/ /daʊn/ /ɒn,,Cắt giảm,v,You should cut down on sugary drinks. (Bạn nên cắt giảm đồ uống nhiều đường),Chủ đề: Tiền bạc & Mua sắm
set aside / /set/ /əˈsaɪd,,Dành dụm,v,He sets aside money every month for future plans. (Anh ấy dành dụm tiền mỗi tháng cho kế hoạch tương lai),Chủ đề: Tiền bạc & Mua sắm
transaction,/trænˈzæk.ʃən/,Giao dịch,n,Online transactions are becoming more common. (Các giao dịch online ngày càng phổ biến),Chủ đề: Tiền bạc & Mua sắm
make ends meet / /meɪk/ /endz/ /miːt,,Kiếm sống,v,Many people work two jobs to make ends meet. (Nhiều người làm hai công việc để kiếm sống),Chủ đề: Tiền bạc & Mua sắm
saving money for a rainy day / /ˈseɪ.vɪŋ/ /ˈmʌn.i/ /fɔːr/ /ə/ /reɪn/ /deɪ,,Dành dụm tiền cho lúc khó khăn,idm,It's wise to save money for a rainy day. (Tiết kiệm tiền cho những lúc khó khăn là điều khôn ngoan),Chủ đề: Tiền bạc & Mua sắm
breeze,/briːz/,Làn gió nhẹ,n,A gentle breeze blew through the trees. (Một làn gió nhẹ thổi qua những hàng cây),Chủ đề: Thiên nhiên & Thời tiết
humidity,/hjuːˈmɪdəti/,Độ ẩm,n,High humidity makes the air feel warmer. (Độ ẩm cao khiến không khí cảm thấy nóng hơn),Chủ đề: Thiên nhiên & Thời tiết
scarce,/skeəs/,Hiếm,adj,Food became scarce after the storm. (Thức ăn trở nên khan hiếm sau cơn bão),Chủ đề: Thiên nhiên & Thời tiết
snowflake,/ˈsnəʊfleɪk/,Bông tuyết,n,Each snowflake has a unique shape. (Mỗi bông tuyết đều có hình dạng riêng),Chủ đề: Thiên nhiên & Thời tiết
snowman,/ˈsnəʊmæn/,Người tuyết,n,The children built a big snowman. (Lũ trẻ xây một người tuyết lớn),Chủ đề: Thiên nhiên & Thời tiết
freezing cold weather / /ˈfriːzɪŋ/ /kəʊld/ /ˈweðə(r),,Thời tiết rất lạnh,n,We stayed indoors because of the freezing cold weather. (Chúng tôi ở trong nhà vì thời tiết quá lạnh),Chủ đề: Thiên nhiên & Thời tiết
natural phenomenon / /ˈnætʃrəl/ /fəˈnɒmɪnən,,Hiện tượng tự nhiên,n,The rainbow is a beautiful natural phenomenon. (Cầu vồng là một hiện tượng tự nhiên đẹp),Chủ đề: Thiên nhiên & Thời tiết
tremble with cold / /ˈtrembl/ /wɪð/ /kəʊld,,Run lên vì lạnh,v,He trembled with cold after walking in the snow. (Anh ấy run lên vì lạnh sau khi đi trong tuyết),Chủ đề: Thiên nhiên & Thời tiết
vibe,/vaɪbz/,Không khí,n,This place has a relaxing vibe. (Nơi này có không khí rất thư giãn),Chủ đề: Thiên nhiên & Thời tiết
scorching heat / /ˈskɔːtʃɪŋ/ /hiːt,,Nắng nóng gay gắt,n,We couldn't go outside because of the scorching heat. (Chúng tôi không thể ra ngoài vì cái nóng gay gắt),Chủ đề: Thiên nhiên & Thời tiết
torrential rain / /təˈrenʃl/ /reɪn,,Mưa rất to,n,Torrential rain caused flooding in the city. (Mưa rất to gây ngập lụt trong thành phố),Chủ đề: Thiên nhiên & Thời tiết
bitterly cold weather / /ˈbɪtəli/ /kəʊld/ /ˈweðə(r),,Trời lạnh thấu xương,n,It was bitterly cold this morning. (Trời lạnh thấu xương vào sáng nay),Chủ đề: Thiên nhiên & Thời tiết
natural calamities / /ˈnætʃrəl/ /kəˈlæmətiiz,,Thiên tai,n,Natural calamities can destroy entire villages. (Thiên tai có thể phá hủy cả làng),Chủ đề: Thiên nhiên & Thời tiết
extreme weather conditions / /ɪkˈstriːm/ /ˈweðə(r)/ /kənˈdɪʃnz,,Điều kiện thời tiết cực đoan,n,Extreme weather conditions affect daily life. (Điều kiện thời tiết khắc nghiệt ảnh hưởng đến cuộc sống),Chủ đề: Thiên nhiên & Thời tiết
property,/ˈprɒpəti/,Tài sản,n,The storm damaged a lot of property. (Cơn bão phá hủy nhiều tài sản),Chủ đề: Thiên nhiên & Thời tiết
inundated,/ˈɪnʌndeɪt/,Bị ngập lụt,adj,The fields were inundated after the heavy rain. (Cánh đồng bị ngập sau trận mưa lớn),Chủ đề: Thiên nhiên & Thời tiết
precipitation,/prɪˌsɪpɪˈteɪʃn/,Lượng mưa,n,This area has high annual precipitation. (Khu vực này có lượng mưa hằng năm cao),Chủ đề: Thiên nhiên & Thời tiết
record high / /ˈrekɔːd/ /haɪ,,Cao kỷ lục,adj,Temperatures reached a record high yesterday. (Nhiệt độ đạt mức cao kỷ lục hôm qua),Chủ đề: Thiên nhiên & Thời tiết
statistics,/stəˈtɪstɪks/,Thống kê,n,Statistics show an increase in rainfall. (Thống kê cho thấy lượng mưa tăng lên),Chủ đề: Thiên nhiên & Thời tiết
emergency announcement / /ɪˈmɜːdʒənsi/ /əˈnaʊnsmənt,,Thông báo khẩn cấp,n,The government issued an emergency announcement. (Chính phủ đưa ra một thông báo khẩn cấp),Chủ đề: Thiên nhiên & Thời tiết
pouring rain / /pɔː(r)/ /reɪn,,Mưa xối xả,n,We got soaked in the pouring rain. (Chúng tôi bị ướt sũng trong mưa xối xả),Chủ đề: Thiên nhiên & Thời tiết
disturbance,/dɪˈstɜːbəns/,Xáo trộn,phiền toái,n,Chủ đề: Thiên nhiên & Thời tiết
death toll / /deθ/ /təʊl,,Tỷ lệ tử vong,n,The death toll rose after the disaster. (Tỷ lệ tử vong tăng sau thảm họa),Chủ đề: Thiên nhiên & Thời tiết
dangerous epidemics / /ˈdeɪndʒərəs/ /ˌepɪˈdemɪks,,Dịch bệnh nguy hiểm,n,Dangerous epidemics spread quickly. (Dịch bệnh nguy hiểm lây lan nhanh),Chủ đề: Thiên nhiên & Thời tiết
concerted effort / /kənˈsɜːtɪd/ /ˈefət,,Nỗ lực chung,n,We need a concerted effort to solve this issue. (Chúng ta cần nỗ lực chung để giải quyết vấn đề),Chủ đề: Thiên nhiên & Thời tiết
global warming / /ˈɡləʊbl/ /ˈwɔːmɪŋ,,Sự nóng lên toàn cầu,n,Global warming affects every country. (Sự nóng lên toàn cầu ảnh hưởng đến mọi quốc gia),Chủ đề: Thiên nhiên & Thời tiết
deforestation,/ˌdiːˌfɒrɪˈsteɪʃn/,Phá rừng,n,Deforestation leads to loss of habitats. (Phá rừng dẫn đến mất môi trường sống),Chủ đề: Thiên nhiên & Thời tiết
ozone depletion / /ˈəʊzəʊn/ /dɪˈpliːʃn,,Sự suy giảm tầng ô-zôn,n,Ozone depletion increases UV radiation. (Sự suy giảm tầng ô-zôn làm tăng tia UV),Chủ đề: Thiên nhiên & Thời tiết
to raise,/reɪz/,= to bring up: Nuôi dạy trẻ,verb,Raising children is a huge responsibility. (Nuôi dạy con cái là một trách nhiệm to lớn.),Giao tiếp: Gia đình
childhood,/ˈtʃaɪld.hʊd/,Tuổi thơ,noun,My childhood was happy and carefree. (Tuổi thơ của tôi thật hạnh phúc và vô tư.),Giao tiếp: Gia đình
adolescence / teenage years / /ˌæd.əˈles.əns/ ; /ˈtiːn.eɪdʒ jɪəz,,Thanh thiếu niên,noun,My grandmother guided me through the turbulent waters of adolescence. (Bà tôi dẫn tôi qua vùng nước sóng gió của tuổi thanh xuân.),Giao tiếp: Gia đình
to play truant / to skive off / /ˈtruː.ənt/ ; /skaɪv ɒf,,Trốn học,verb,I used to play truant and spend the whole day in the arcades. (Tôi từng trốn học và dành cả ngày ở khu chơi game.),Giao tiếp: Gia đình
juvenile delinquency,/ˈdʒuː.vən.aɪl dɪˈlɪŋ.kwən.si/,Tội phạm vị thành niên,noun,Juvenile delinquency rates are higher in urban areas. (Tỷ lệ tội phạm vị thành niên cao hơn ở thành thị.),Giao tiếp: Gia đình
neglected,/nɪˈɡlektɪd/,Thờ ơ,adjective,Neglected teenagers seek attention and will do anything to get it. (Thanh thiếu niên bị ngó lơ sẽ làm mọi cách để được chú ý.),Giao tiếp: Gia đình
nuclear family,/ˈnjuː.kli.ə ˈfæm.əl.i/,Gia đình hạt nhân,noun,"Most people live in nuclear families nowadays. (Ngày nay, hầu hết mọi người sống trong gia đình hạt nhân.)",Giao tiếp: Gia đình
to get on well with somebody,/ɡet ɒn wel/,Hòa thuận,verb,I wish I could get on well with my mother-in-law. (Tôi ước có thể hòa thuận với mẹ chồng.),Giao tiếp: Gia đình
relative,/ˈrel.ə.tɪv/,Họ hàng,người thân,noun,Giao tiếp: Gia đình
in-laws,/ˈɪn.lɔːz/,Bố mẹ vợ/chồng,noun,I never know what to buy for my in-laws. (Tôi không biết nên mua gì cho bố mẹ chồng/vợ.),Giao tiếp: Gia đình
red-letter day,/ˌredˈlet.ər deɪ/,Ngày trọng đại,noun,"If I pass the exam, it’ll be a red-letter day. (Nếu tôi thi đỗ, đó sẽ là một ngày trọng đại.)",Giao tiếp: Gia đình
stepparent / stepmother / stepfather / /ˈstep.peə.rənt/ ; /ˈstep.mʌð.ər/ ; /ˈstep.fɑː.ðər,,Bố mẹ kế,noun,Cinderella lived with a wicked stepmother. (Cô bé Lọ Lem sống với một mẹ kế độc ác.),Giao tiếp: Gia đình
stepfamily / blended family / /ˈstep.fæm.əl.i/ ; /ˈblen.dɪd ˈfæm.əl.i,,Gia đình có cha hoặc mẹ kế,noun,Creating a blended family is a difficult process. (Tạo dựng một gia đình kế là quá trình khó khăn.),Giao tiếp: Gia đình
siblings,/ˈsɪb.lɪŋz/,Anh chị em,noun,Children with no siblings are often spoilt. (Trẻ không có anh chị em thường được cưng chiều.),Giao tiếp: Gia đình
to allow / permit / let / /əˈlaʊ/ ; /pəˈmɪt/ ; /let,,Cho phép,verb,Minors shouldn’t be allowed to buy alcohol. (Người dưới 18 tuổi không được phép mua rượu bia.),Giao tiếp: Gia đình
quality time,/ˈkwɒl.ɪ.ti taɪm/,Thời gian chất lượng,noun,Spending quality time with children is important. (Dành thời gian chất lượng với con rất quan trọng.),Giao tiếp: Gia đình
to take after somebody,/teɪk ˈɑːf.tər/,Có nét giống ai đó,verb,Children often take after their grandparents. (Trẻ thường giống ông bà.),Giao tiếp: Gia đình
overprotective,/ˌəʊ.və.prəˈtek.tɪv/,Quá bảo bọc,adjective,Overprotective parents should seek help to relax. (Cha mẹ quá bảo bọc nên tìm hỗ trợ để thư giãn.),Giao tiếp: Gia đình
strict,/strɪkt/,Nghiêm khắc,adjective,My mother was very strict. (Mẹ tôi rất nghiêm khắc.),Giao tiếp: Gia đình
grounded,/ˈɡraʊn.dɪd/,Cấm túc,adjective,Strict teachers are more popular than lenient ones. (Giáo viên nghiêm khắc được ưa chuộng hơn giáo viên dễ tính.),Giao tiếp: Gia đình
foster family,/ˈfɒs.tər ˈfæm.əl.i/,Gia đình nuôi dưỡng,noun,Foster families can change a child's life. (Gia đình nuôi dưỡng có thể thay đổi cuộc sống một đứa trẻ.),Giao tiếp: Gia đình
amusement park,/əˈmjuːz.mənt pɑːk/,= funfair : công viên giải trí,noun,You can always buy pink cotton candy in an amusement park. (Bạn luôn có thể mua kẹo bông gòn trong công viên giải trí.),Giao tiếp: Thời gian rảnh & Sở thích
slot machine,/ˈslɒt məˌʃiːn/,Máy đánh bạc,noun,The only way to win on slot machines is not to play them. (Cách duy nhất để thắng là không chơi.),Giao tiếp: Thời gian rảnh & Sở thích
roller coaster,/ˈrəʊ.lə ˌkəʊ.stər/,Tàu lượn siêu tốc,noun,Roller coasters make me sick to my stomach. (Tàu lượn làm tôi buồn nôn.),Giao tiếp: Thời gian rảnh & Sở thích
to take up,/teɪk ʌp/,Bắt đầu (1 thói quen),verb,He took up golf when he retired. (Ông ấy bắt đầu chơi golf khi nghỉ hưu.),Giao tiếp: Thời gian rảnh & Sở thích
diy,/ˌdiː.aɪˈwaɪ/,Tự làm,noun,"I’m good at DIY, but I had to call a plumber. (Tôi khá giỏi tự làm nhưng phải gọi thợ nước.)",Giao tiếp: Thời gian rảnh & Sở thích
pottery,/ˈpɒt.ər.i/,Làm gốm,noun,Making pottery is such a creative activity. (Làm gốm thật sáng tạo.),Giao tiếp: Thời gian rảnh & Sở thích
knitting,/ˈnɪt.ɪŋ/,Đan len,noun,Knitting helps you relax. (Đan len giúp bạn thư giãn.),Giao tiếp: Thời gian rảnh & Sở thích
to mow the lawn,/məʊ ðə lɔːn/,Cắt cỏ,verb,My neighbours always mow the lawn on Sundays. (Họ luôn cắt cỏ Chủ nhật.),Giao tiếp: Thời gian rảnh & Sở thích
hedge,/hedʒ/,Bụi cây,noun,Trimming the hedge is hard work. (Tỉa bụi cây rất vất vả.),Giao tiếp: Thời gian rảnh & Sở thích
sitcom,/ˈsɪt.kɒm/,= situation comedy : hài kịch tình huống,noun,'Friends' is the most popular sitcom ever. (‘Friends’ là sitcom nổi tiếng nhất.),Giao tiếp: Thời gian rảnh & Sở thích
review,/rɪˈvjuː/,Đánh giá,noun,Writing reviews is a fun job. (Viết đánh giá là công việc thú vị.),Giao tiếp: Thời gian rảnh & Sở thích
cinemagoer,/ˈsɪn.ə.məˌɡəʊ.ər/,= moviegoer : người mê phim,noun,My uncle is a devoted cinemagoer. (Chú tôi mê điện ảnh.),Giao tiếp: Thời gian rảnh & Sở thích
city dweller,/ˈsɪt.i ˌdwel.ər/,Dân thành thị,noun,City dwellers should spend more time outdoors. (Dân thành thị nên ra ngoài nhiều hơn.),Giao tiếp: Thời gian rảnh & Sở thích
hiking,/ˈhaɪ.kɪŋ/,Đi bộ đường dài,noun,I sprained my ankle while hiking. (Tôi bong gân lúc đi leo núi.),Giao tiếp: Thời gian rảnh & Sở thích
scenery,/ˈsiː.nər.i/,= landscape : phong cảnh,noun,The scenery was breathtaking. (Phong cảnh đẹp đến nghẹt thở.),Giao tiếp: Thời gian rảnh & Sở thích
atmosphere,/ˈæt.məs.fɪər/,= ambiance : bầu không khí,noun,I love the familiar atmosphere of our local pub. (Tôi thích bầu không khí quen thuộc của quán.),Giao tiếp: Thời gian rảnh & Sở thích
a total,/ə ˈtəʊ.təl/,Tổng số,noun,A total of 500 people attended the event. (Tổng cộng 500 người tham dự.),Viết học thuật: Biểu đồ cột
an overall figure,/ˈəʊ.və.rɔːl ˈfɪɡ.ə/,Tổng số chung,noun,The overall figure rose significantly. (Tổng số chung tăng đáng kể.),Viết học thuật: Biểu đồ cột
amount to,/əˈmaʊnt tuː/,Tổng cộng; lên tới,verb,"Expenses amounted to $2,000. (Chi phí lên tới 2,000 đô.)",Viết học thuật: Biểu đồ cột
total,/ˈtəʊ.təl/,Tổng cộng,verb,"The costs total nearly $5,000. (Chi phí tổng cộng gần 5,000 đô.)",Viết học thuật: Biểu đồ cột
a figure,/ˈfɪɡ.ər/,Một con số,noun,This figure shows rapid growth. (Con số này cho thấy tăng trưởng nhanh.),Viết học thuật: Biểu đồ cột
a number,/ˈnʌm.bər/,Một con số,noun,A large number of students joined. (Nhiều sinh viên tham gia.),Viết học thuật: Biểu đồ cột
stand at,/stænd æt/,Đạt mức,verb,Unemployment stood at 5%. (Tỷ lệ thất nghiệp đạt mức 5%.),Viết học thuật: Biểu đồ cột
reach,/riːtʃ/,Đạt tới,verb,Sales reached a new high. (Doanh số đạt mức cao mới.),Viết học thuật: Biểu đồ cột
a percentage,/pəˈsen.tɪdʒ/,Tỉ lệ phần trăm,noun,A large percentage of people agreed. (Một tỉ lệ lớn người đồng ý.),Viết học thuật: Biểu đồ cột
a proportion,/prəˈpɔː.ʃən/,Tỉ lệ,noun,A high proportion of students passed. (Tỉ lệ lớn sinh viên đỗ.),Viết học thuật: Biểu đồ cột
comprise,/kəmˈpraɪz/,Chiếm ; bao gồm,verb,Women comprise 60% of the workforce. (Phụ nữ chiếm 60% lực lượng lao động.),Viết học thuật: Biểu đồ cột
make up,/meɪk ʌp/,Chiếm,verb,Rent makes up half of my expenses. (Tiền thuê chiếm một nửa chi phí.),Viết học thuật: Biểu đồ cột
account for,/əˈkaʊnt fɔːr/,Chiếm,verb,Imports account for 30% of GDP. (Nhập khẩu chiếm 30% GDP.),Viết học thuật: Biểu đồ cột
an increase,/ɪnˈkriːs/,Sự tăng,noun,There was an increase in population. (Có sự gia tăng dân số.),Viết học thuật: Biểu đồ cột
a rise,/raɪz/,Sự tăng,noun,A rise in prices occurred last year. (Có sự tăng giá năm trước.),Viết học thuật: Biểu đồ cột
increase,/ɪnˈkriːs/,Tăng,verb,Sales increased sharply. (Doanh số tăng mạnh.),Viết học thuật: Biểu đồ cột
rise,/raɪz/,Tăng,verb,Prices rose quickly. (Giá tăng nhanh.),Viết học thuật: Biểu đồ cột
go up,/ɡəʊ ʌp/,Tăng lên,verb,The temperature went up. (Nhiệt độ tăng lên.),Viết học thuật: Biểu đồ cột
a decrease,/ˈdiː.kriːs/,Sự giảm,noun,A decrease in revenue was recorded. (Ghi nhận sự giảm doanh thu.),Viết học thuật: Biểu đồ cột
a decline,/dɪˈklaɪn/,Sự giảm,noun,A decline in sales was reported. (Báo cáo cho thấy doanh số giảm.),Viết học thuật: Biểu đồ cột
