word,pronunciation,meaning,word_type,example,topic
expire,/ɪkˈspaɪər/,hết hạn,verb,The warranty on this product will expire next month. (Bảo hành cho sản phẩm này sẽ hết hạn vào tháng tới.),Từ vựng: Công việc
benefits,/ˈbɛnɪfɪts/,phúc lợi,noun,The company offers excellent health benefits. (Công ty cung cấp các phúc lợi sức khỏe tuyệt vời.),Từ vựng: Công việc
headquarters,/hɛdˈkwɔːtərz/,trụ sở,noun,The company headquarters is located in New York. (Trụ sở chính của công ty đặt tại New York.),Từ vựng: Công việc
branch,/brɑːntʃ/,chi nhánh,noun,They opened a new branch in the city center. (Họ đã mở một chi nhánh mới ở trung tâm thành phố.),Từ vựng: Công việc
access card,/ˈæksɛs kɑːrd/,thẻ ra vào,phrase,You need an access card to enter the building. (Bạn cần một thẻ ra vào để vào tòa nhà.),Từ vựng: Công việc
allocate,/ˈæləkeɪt/,"phân phối, cấp",verb,The manager will allocate tasks to each team member. (Quản lý sẽ phân công nhiệm vụ cho từng thành viên trong nhóm.),Từ vựng: Công việc
laptop computer,/ˈlæptɒp kəmˈpjuːtər/,máy tính xách tay,phrase,I bought a new laptop computer for work. (Tôi đã mua một chiếc máy tính xách tay mới cho công việc.),Từ vựng: Công việc
sales report,/seɪlz rɪˈpɔːrt/,báo cáo kinh doanh,phrase,The sales report shows a significant increase in revenue. (Báo cáo kinh doanh cho thấy doanh thu tăng đáng kể.),Từ vựng: Công việc
workflow process,/ˈwɜːrkfloʊ ˈprɒsɛs/,quá trình xử lý công việc,phrase,We need to optimize the workflow process to improve efficiency. (Chúng ta cần tối ưu hóa quy trình xử lý công việc để cải thiện hiệu quả.),Từ vựng: Công việc
deal,/diːl/,thỏa thuận mua bán,noun,They closed a lucrative deal with the new client. (Họ đã chốt một thỏa thuận béo bở với khách hàng mới.),Từ vựng: Công việc
commute,/kəˈmjuːt/,đi lại hàng ngày từ nhà đến nơi làm việc,verb,My commute to work takes about an hour. (Việc đi làm hàng ngày của tôi mất khoảng một giờ.),Từ vựng: Công việc
call in sick,/kɔːl ɪn sɪk/,gọi điện báo ốm,phrase,I have to call in sick today because I'm not feeling well. (Tôi phải gọi điện báo ốm hôm nay vì tôi cảm thấy không khỏe.),Từ vựng: Công việc
annual budget,/ˈænjuəl ˈbʌdʒɪt/,ngân sách hàng năm,phrase,The company is preparing its annual budget for the next fiscal year. (Công ty đang chuẩn bị ngân sách hàng năm cho năm tài chính tiếp theo.),Từ vựng: Công việc
specialty,/ˈspɛʃəlti/,"chuyên ngành, chuyên môn",noun,Her specialty is in digital marketing. (Chuyên môn của cô ấy là tiếp thị kỹ thuật số.),Từ vựng: Công việc
assignment,/əˈsaɪnmənt/,nhiệm vụ (được phân công),noun,The teacher gave us a challenging assignment. (Giáo viên đã giao cho chúng tôi một nhiệm vụ đầy thử thách.),Từ vựng: Công việc
marketing strategy,/ˈmɑːrkɪtɪŋ ˈstrætədʒi/,chiến lược kinh doanh,phrase,The new marketing strategy aims to reach a wider audience. (Chiến lược tiếp thị mới nhằm tiếp cận đối tượng khán giả rộng hơn.),Từ vựng: Công việc
performance,/pərˈfɔːrməns/,"hiệu suất, thành tích",noun,His performance in the last quarter was outstanding. (Hiệu suất của anh ấy trong quý vừa qua rất xuất sắc.),Từ vựng: Công việc
bulletin board,/ˈbʊlətɪn bɔːrd/,bảng thông báo,phrase,Please check the bulletin board for important announcements. (Vui lòng kiểm tra bảng thông báo để biết các thông báo quan trọng.),Từ vựng: Công việc
registration,/ˌrɛdʒɪˈstreɪʃən/,sự đăng kí,noun,Please complete your registration by Friday.,Từ vựng: Hội nghị & Công tác
information packet,/ˌɪnfərˈmeɪʃən ˈpækɪt/,"một xấp các tập sách nhỏ, cung cấp thông tin",phrase,We will provide you with an information packet upon arrival.,Từ vựng: Hội nghị & Công tác
itinerary,/aɪˈtɪnəˌrɛri/,lộ trình,noun,Please review the itinerary for our upcoming trip.,Từ vựng: Hội nghị & Công tác
amenities,/əˈmɛnɪtiz/,tiện nghi,noun,The hotel offers many amenities for its guests.,Từ vựng: Hội nghị & Công tác
agenda,/əˈdʒɛndə/,chương trình nghị sự,noun,The agenda for the meeting has been distributed.,Từ vựng: Hội nghị & Công tác
give a presentation,/ɡɪv ə ˌprɛzənˈteɪʃən/,trình bày,phrase,She will give a presentation on her research.,Từ vựng: Hội nghị & Công tác
be away on a trip,/bi əˈweɪ ɒn ə trɪp/,đang đi công tác,phrase,He will be away on a trip for two weeks.,Từ vựng: Hội nghị & Công tác
fundraising,/ˈfʌndˌreɪzɪŋ/,gây quỹ,noun,The organization is holding a fundraising event.,Từ vựng: Hội nghị & Công tác
conference,/ˈkɒnfərəns/,hội nghị,noun,We are attending a large international conference.,Từ vựng: Hội nghị & Công tác
arrange a meeting,/əˈreɪndʒ ə ˈmiːtɪŋ/,chuẩn bị một cuộc họp,phrase,Could you please arrange a meeting with the client?,Từ vựng: Hội nghị & Công tác
handout,/ˈhændˌaʊt/,tài liệu phát tay,noun,Please find the handout attached.,Từ vựng: Hội nghị & Công tác
draft,/drɑːft/,"bản phác thảo, đề cương",noun,I have completed the first draft of the report.,Từ vựng: Hội nghị & Công tác
training seminar,/ˈtreɪnɪŋ ˈsɛmɪnɑːr/,hội thảo huấn luyện,phrase,She attended a training seminar on leadership skills.,Từ vựng: Hội nghị & Công tác
trade show,/treɪd ʃoʊ/,hội chợ triển lãm thương mại,phrase,We are exhibiting at the annual trade show.,Từ vựng: Hội nghị & Công tác
submit the proposal,/səbˈmɪt ðə prəˈpoʊzəl/,đệ trình bản kế hoạch,phrase,Please submit the proposal by the deadline.,Từ vựng: Hội nghị & Công tác
session,/ˈsɛʃən/,"niên khóa, phiên họp",noun,The next session of the conference will begin shortly.,Từ vựng: Hội nghị & Công tác
special offer,/ˈspɛʃəl ˈɔːfər/,giảm giá đặc biệt,phrase,They are having a special offer on all electronics this week. (Họ đang có chương trình giảm giá đặc biệt cho tất cả các mặt hàng điện tử trong tuần này.),Từ vựng: Sản phẩm
inventory,/ˈɪnvəntəri/,bản kê khai hàng hóa,noun,We need to update the inventory records. (Chúng ta cần cập nhật hồ sơ bản kê khai hàng hóa.),Từ vựng: Sản phẩm
out of stock,/aʊt əv stɒk/,hết hàng trong kho,phrase,The item is currently out of stock. (Món hàng hiện đang hết hàng trong kho.),Từ vựng: Sản phẩm
refund,/ˈriːfʌnd/,"trả lại tiền, sự bồi hoàn",noun,I would like to request a refund for this damaged item. (Tôi muốn yêu cầu hoàn lại tiền cho món hàng bị hỏng này.),Từ vựng: Sản phẩm
manufacturer,/ˌmænjuˈfæktʃərər/,nhà sản xuất,noun,The manufacturer is responsible for the product's quality. (Nhà sản xuất chịu trách nhiệm về chất lượng sản phẩm.),Từ vựng: Sản phẩm
warehouse,/ˈweərhaʊs/,kho hàng,noun,They store all their goods in a large warehouse. (Họ lưu trữ tất cả hàng hóa của mình trong một nhà kho lớn.),Từ vựng: Sản phẩm
stockroom,/ˈstɒkruːm/,kho hàng,noun,Please check the stockroom for the missing item. (Xin vui lòng kiểm tra kho hàng xem có món đồ bị thiếu không.),Từ vựng: Sản phẩm
release,/rɪˈliːs/,tung ra (sản phẩm),verb,The company plans to release a new model next month. (Công ty dự định tung ra một mẫu mới vào tháng tới.),Từ vựng: Sản phẩm
launch,/lɔːntʃ/,tung ra (sản phẩm),verb,They will launch the new product at the trade show. (Họ sẽ tung ra sản phẩm mới tại hội chợ thương mại.),Từ vựng: Sản phẩm
details,/ˈdiːteɪlz/,chi tiết (sản phẩm),noun,Can you provide more details about the product? (Bạn có thể cung cấp thêm chi tiết về sản phẩm không?),Từ vựng: Sản phẩm
estimates,/ˈɛstɪməts/,bảng báo giá,noun,We received several estimates for the project. (Chúng tôi đã nhận được nhiều bảng báo giá cho dự án.),Từ vựng: Sản phẩm
expedite,/ˈɛkspɪdaɪt/,xúc tiến,verb,We need to expedite the delivery process. (Chúng ta cần xúc tiến quy trình giao hàng.),Từ vựng: Sản phẩm
defects,/ˈdiːfɛkts/,khuyết điểm,noun,The product has several manufacturing defects. (Sản phẩm có một vài khuyết điểm trong quá trình sản xuất.),Từ vựng: Sản phẩm
warranty,/ˈwɒrənti/,giấy bảo hành,noun,The appliance comes with a one-year warranty. (Thiết bị đi kèm với giấy bảo hành một năm.),Từ vựng: Sản phẩm
rebate,/ˈriːbeɪt/,hoàn lại một phần tiền (sau khi đã mua sản phẩm),noun,You can get a rebate by mailing in the coupon. (Bạn có thể nhận được tiền hoàn lại bằng cách gửi phiếu giảm giá qua thư.),Từ vựng: Sản phẩm
distribute,/dɪˈstrɪbjuːt/,phân phối,verb,They are responsible for distributing the goods to retailers. (Họ chịu trách nhiệm phân phối hàng hóa cho các nhà bán lẻ.),Từ vựng: Sản phẩm
supplier,/səˈplaɪər/,nhà cung cấp,noun,We have a reliable supplier for our raw materials. (Chúng tôi có một nhà cung cấp đáng tin cậy cho nguyên liệu thô của mình.),Từ vựng: Sản phẩm
wall-mounted unit,/ˈwɔːlˌmaʊntɪd ˈjuːnɪt/,loại treo tường,phrase,They installed a new wall-mounted unit in the bathroom. (Họ đã lắp đặt một thiết bị treo tường mới trong phòng tắm.),Từ vựng: Sản phẩm
bulk purchase,/bʌlk ˈpɜːrtʃəs/,mua hàng số lượng lớn,phrase,We can offer a discount for a bulk purchase. (Chúng tôi có thể đưa ra chiết khấu cho việc mua hàng số lượng lớn.),Từ vựng: Sản phẩm
applaud the speaker,/əˈplɔːd ðə ˈspiːkər/,hoan nghênh diễn giả,phrase,The audience applauded the speaker enthusiastically. (Khán giả hoan nghênh diễn giả một cách nhiệt tình.),Từ vựng: Nơi làm việc
document folder,/ˈdɒkjʊmənt ˈfəʊldər/,bìa tài liệu,phrase,Please put these papers in the document folder. (Xin hãy cho những giấy tờ này vào bìa tài liệu.),Từ vựng: Nơi làm việc
look through microscope,/lʊk θruː ˈmaɪkrəʊskəʊp/,nhìn vào kính hiển vi,phrase,The scientist will look through the microscope to examine the sample. (Nhà khoa học sẽ nhìn vào kính hiển vi để kiểm tra mẫu vật.),Từ vựng: Nơi làm việc
machine lid,/məˈʃiːn lɪd/,nắp đậy máy,phrase,Make sure to close the machine lid properly. (Hãy đảm bảo đóng nắp đậy máy đúng cách.),Từ vựng: Nơi làm việc
speak into microphone,/spiːk ˈɪntə ˈmaɪkrəʊfəʊn/,nói qua micro,phrase,Speak clearly into the microphone for everyone to hear. (Hãy nói rõ vào micro để mọi người nghe thấy.),Từ vựng: Nơi làm việc
make photocopies,/meɪk ˈfəʊtəʊkɒpiz/,sao chép lại,phrase,I need to make photocopies of this document. (Tôi cần sao chép lại tài liệu này.),Từ vựng: Nơi làm việc
adjust equipment,/əˈdʒʌst ɪˈkwɪpmənt/,điều chỉnh thiết bị,phrase,You need to adjust the equipment before starting the experiment. (Bạn cần điều chỉnh thiết bị trước khi bắt đầu thí nghiệm.),Từ vựng: Nơi làm việc
wear protective glasses,/wɛər prəˈtɛktɪv ˈɡlɑːsɪz/,đeo kính bảo hộ,phrase,Always wear protective glasses when working with chemicals. (Luôn đeo kính bảo hộ khi làm việc với hóa chất.),Từ vựng: Nơi làm việc
doorway,/ˈdɔːrweɪ/,cửa ra vào,noun,"He stood in the doorway, waiting. (Anh ấy đứng ở cửa ra vào, chờ đợi.)",Từ vựng: Nơi làm việc
look through report,/lʊk θruː rɪˈpɔːrt/,đọc kỹ bản báo cáo,phrase,Please look through this report and give me your feedback. (Xin hãy đọc kỹ bản báo cáo này và cho tôi ý kiến phản hồi.),Từ vựng: Nơi làm việc
stare at screen,/stɛər æt skriːn/,nhìn chăm chú vào màn hình,phrase,He was staring at the screen for hours. (Anh ấy đã nhìn chăm chú vào màn hình hàng giờ.),Từ vựng: Nơi làm việc
be seated at workstation,/bi ˈsiːtɪd æt ˈwɜːrksteɪʃən/,ngồi ở phòng làm việc,phrase,"She is seated at her workstation, completing her tasks. (Cô ấy đang ngồi ở phòng làm việc, hoàn thành các nhiệm vụ của mình.)",Từ vựng: Nơi làm việc
sort through paperwork,/sɔːrt θruː ˈpeɪpərˌwɜːrk/,sắp xếp tài liệu,phrase,I need to sort through this paperwork before the end of the day. (Tôi cần sắp xếp tài liệu này trước cuối ngày.),Từ vựng: Nơi làm việc
reach for knob,/riːtʃ fɔːr nɒb/,với tới quả đấm cửa,phrase,He reached for the knob to open the door. (Anh ấy với tới quả đấm cửa để mở cửa.),Từ vựng: Nơi làm việc
hold receiver to ear,/həʊld rɪˈsiːvər tuː ɪər/,giữ ống nghe sát tai,phrase,Please hold the receiver to your ear so you can hear better. (Xin hãy giữ ống nghe sát tai để bạn có thể nghe rõ hơn.),Từ vựng: Nơi làm việc
wave in breeze,/weɪv ɪn briːz/,lay động trong gió,phrase,The flag waved in the breeze. (Lá cờ lay động trong gió.),Từ vựng: Nơi làm việc
rest outdoors,/rest ˈaʊtdɔːrz/,nghỉ ngoài trời,phrase,It's nice to rest outdoors on a sunny day. (Thật tuyệt khi nghỉ ngơi ngoài trời vào một ngày nắng đẹp.),Từ vựng: Nơi làm việc
extend over hill,/ɪkˈstɛnd ˈəʊvər hɪl/,trải dài đến bên kia đồi,phrase,The valley extends over the hill. (Thung lũng trải dài đến bên kia đồi.),Từ vựng: Nơi làm việc
upside-down,/ˌʌpsaɪd ˈdaʊn/,lộn ngược,adverb,The picture was hanging upside-down. (Bức tranh bị treo lộn ngược.),Từ vựng: Nơi làm việc
be positioned,/biː pəˈzɪʃənd/,được đặt vào,phrase,The statue is positioned in the center of the plaza. (Bức tượng được đặt vào giữa quảng trường.),Từ vựng: Nơi làm việc
walk toward archway,/wɔːk təˈwɔːrdz ˈɑːrtʃweɪ/,bước theo lối đi có mái vòm,phrase,They walked toward the archway leading into the garden. (Họ bước theo lối đi có mái vòm dẫn vào khu vườn.),Từ vựng: Nơi làm việc
admire sculptures,/ədˈmaɪər ˈskʌlptʃərz/,thưởng thức các tác phẩm điêu khắc,phrase,Visitors enjoyed admiring the sculptures in the museum. (Du khách thích thú thưởng thức các tác phẩm điêu khắc trong bảo tàng.),Từ vựng: Nơi làm việc
hilltop,/ˈhɪltɒp/,đỉnh đồi,noun,They sat on the hilltop to watch the sunset. (Họ ngồi trên đỉnh đồi để ngắm hoàng hôn.),Từ vựng: Nơi làm việc
be seated in a row,/biː ˈsiːtɪd ɪn ə rəʊ/,ngồi thẳng hàng,phrase,"The students were seated in a row, facing the teacher. (Các học sinh ngồi thẳng hàng, đối diện với giáo viên.)",Từ vựng: Nơi làm việc
water plants,/ˈwɔːtər plɑːnts/,tưới nước cho cây,phrase,Don't forget to water the plants while I'm away. (Đừng quên tưới nước cho cây khi tôi đi vắng.),Từ vựng: Nơi làm việc
being seated with legs crossed,/ˈbiːɪŋ ˈsiːtɪd wɪð lɛɡz krɒst/,ngồi bắt chéo chân,phrase,"He was being seated with his legs crossed, looking relaxed. (Anh ấy đang ngồi bắt chéo chân, trông thật thư thái.)",Từ vựng: Nơi làm việc
spray water into air,/spreɪ ˈwɔːtər ˈɪntuː ɛər/,xịt nước vào không khí,phrase,The fountain sprayed water into the air. (Đài phun nước xịt nước vào không khí.),Từ vựng: Nơi làm việc
grassy area,/ˈɡrɑːsi ˈɛəriə/,khu vực phủ đầy cỏ,phrase,Children were playing in the grassy area. (Trẻ em đang chơi đùa trong khu vực phủ đầy cỏ.),Từ vựng: Nơi làm việc
hold fishing pole,/həʊld ˈfɪʃɪŋ pəʊl/,cầm cần câu,phrase,"He was holding a fishing pole, waiting for a bite. (Anh ấy đang cầm một cái cần câu, chờ đợi cá cắn câu.)",Từ vựng: Nơi làm việc
row boat,/rəʊ bəʊt/,chèo thuyền,phrase,They decided to row the boat across the lake. (Họ quyết định chèo thuyền qua hồ.),Từ vựng: Nơi làm việc
in opposite direction,/ɪn ˈɒpəzɪt dɪˈrɛkʃən/,ở hướng ngược lại,phrase,The two cars were moving in opposite directions. (Hai chiếc xe đang di chuyển theo hướng ngược lại.),Từ vựng: Nơi làm việc
be reflected into water,/biː rɪˈflɛktɪd ˈɪntuː ˈwɔːtər/,phản chiếu qua mặt nước,phrase,The mountains were beautifully reflected into the clear water. (Những ngọn núi được phản chiếu đẹp đẽ qua mặt nước trong xanh.),Từ vựng: Nơi làm việc
junior staff,/ˈdʒuːnjər stæf/,nhân viên tập sự,phrase,The junior staff is still learning the ropes.,Từ vựng: Nhân sự
transfer,/ˈtrænsfər/,sự thuyên chuyển,noun,She requested a transfer to a different department.,Từ vựng: Nhân sự
be short-staffed,/bi bɪ ˈʃɔːrt stæft/,thiếu nhân viên,phrase,The hospital will be short-staffed during the holidays.,Từ vựng: Nhân sự
supervisor,/ˈsuːpərvaɪzər/,giám sát viên,noun,My supervisor approved my vacation request.,Từ vựng: Nhân sự
boss,/bɒs/,ông chủ,noun,My boss is very demanding.,Từ vựng: Nhân sự
sales representative,/ˈseɪlz ˌreprəˈzentətɪv/,nhân viên bán hàng,phrase,The sales representative visited our office yesterday.,Từ vựng: Nhân sự
technician,/tɛkˈnɪʃən/,nhân viên kỹ thuật,noun,A technician will come to fix the internet.,Từ vựng: Nhân sự
security officer,/sɪˈkjʊərɪti ˈɒfɪsər/,nhân viên an ninh,phrase,The security officer checked everyone's bags.,Từ vựng: Nhân sự
administrative assistant,/ədˈmɪnɪstrətɪv əˈsɪstənt/,trợ lý giám đốc,phrase,The administrative assistant manages the office schedule.,Từ vựng: Nhân sự
store clerk,/stɔːr klɜːrk/,nhân viên bán hàng,phrase,The store clerk helped me find what I was looking for.,Từ vựng: Nhân sự
personnel,/ˌpɜːrsəˈnɛl/,nhân sự,noun,The company is hiring new personnel.,Từ vựng: Nhân sự
salesperson,/ˈseɪlzˌpɜːrsən/,nhân viên bán hàng,noun,She is a very successful salesperson.,Từ vựng: Nhân sự
crew,/kruː/,"ban, nhóm, đội (công tác)",noun,The film crew arrived early.,Từ vựng: Nhân sự
coworker,/ˈkoʊwɜːrkər/,đồng nghiệp,noun,I have a great relationship with my coworker.,Từ vựng: Nhân sự
colleague,/ˈkɒliːɡ/,đồng nghiệp,noun,He discussed the project with his colleague.,Từ vựng: Nhân sự
plumber,/ˈplʌmər/,thợ sửa ống nước,noun,We need to call a plumber for the leaky faucet.,Từ vựng: Nhân sự
receptionist,/rɪˈsɛpʃənɪst/,nhân viên tiếp tân,noun,The receptionist greeted us warmly.,Từ vựng: Nhân sự
automatic mechanic,/ˌɔːtəˈmætɪk məˈkænɪk/,thợ sửa xe hơi,phrase,The automatic mechanic repaired the transmission.,Từ vựng: Nhân sự
fill out an application,/fɪl aʊt ən ˌæplɪˈkeɪʃn/,điền đơn xin việc,phrase,Please fill out an application form before your interview.,Từ vựng: Phỏng vấn
cover letter,/ˈkʌvər ˈlɛtər/,thư xin việc,noun,She attached a well-written cover letter to her resume.,Từ vựng: Phỏng vấn
candidate,/ˈkændɪdeɪt/,"người dự tuyển, ứng viên",noun,The company is interviewing several candidates for the position.,Từ vựng: Phỏng vấn
qualifications,/ˌkwɒlɪfɪˈkeɪʃnz/,trình độ chuyên môn,noun,His qualifications are excellent for this role.,Từ vựng: Phỏng vấn
certificate,/sərˈtɪfɪkɪt/,"bằng cấp, giấy chứng nhận",noun,You will receive a certificate upon completion of the course.,Từ vựng: Phỏng vấn
company policy,/ˈkʌmpəni ˈpɒləsi/,chính sách công ty,noun,Employees must adhere to the company policy on social media.,Từ vựng: Phỏng vấn
be entitled to do,/bi ɪnˈtaɪtld tu du/,có quyền (làm gì),phrase,All employees be entitled to paid vacation.,Từ vựng: Phỏng vấn
replacement,/rɪˈpleɪsmənt/,người thay thế,noun,We are looking for a suitable replacement for the retiring manager.,Từ vựng: Phỏng vấn
annual salary,/ˈænjuəl ˈsæləri/,lương hàng năm,noun,The annual salary for this position is very competitive.,Từ vựng: Phỏng vấn
vacancy,/ˈveɪkənsi/,chỗ trống,noun,There is a vacancy in the marketing department.,Từ vựng: Phỏng vấn
workplace,/ˈwɜːrkpleɪs/,nơi làm việc,noun,A clean and safe workplace is important for everyone.,Từ vựng: Phỏng vấn
working conditions,/ˈwɜːrkɪŋ kənˈdɪʃnz/,điều kiện làm việc,noun,The company offers excellent working conditions.,Từ vựng: Phỏng vấn
reception desk,/rɪˈsepʃn dɛsk/,bàn lễ tân,noun,Please report to the reception desk upon arrival.,Từ vựng: Phỏng vấn
minimum requirements,/ˈmɪnɪməm rɪˈkwaɪərmənts/,điều kiện tối thiểu,noun,Meeting the minimum requirements is essential for this job.,Từ vựng: Phỏng vấn
narrow down the applicants,/ˈnæroʊ daʊn ði ˈæplɪkənts/,tuyển chọn ứng viên,phrase,We will narrow down the applicants to a shortlist of three.,Từ vựng: Phỏng vấn
float in the water,/floʊt ɪn ðə ˈwɔːtər/,nổi trên mặt nước,phrase,The boat will float in the water.,Từ vựng: Giao thông & Công trường
pedestrian,/pəˈdɛstriən/,người đi bộ,noun,Pedestrians must use the crosswalk.,Từ vựng: Giao thông & Công trường
be packed,/bi pækt/,bị nhét đầy bởi,phrase,The suitcase was packed full.,Từ vựng: Giao thông & Công trường
be parked on the ground,/bi pɑːrkt ɒn ðə ɡraʊnd/,đậu xe trên mặt đất,phrase,The car is parked on the ground.,Từ vựng: Giao thông & Công trường
be lined up in rows,/bi laɪnd ʌp ɪn roʊz/,xếp thẳng hàng,phrase,The chairs were lined up in rows.,Từ vựng: Giao thông & Công trường
block the road,/blɒk ðə roʊd/,chắn đường,phrase,A fallen tree blocked the road.,Từ vựng: Giao thông & Công trường
on the deck of the boat,/ɒn ðə dɛk ɒv ðə boʊt/,trên boong tàu,phrase,We stood on the deck of the boat.,Từ vựng: Giao thông & Công trường
in the back of the truck,/ɪn ðə bæk ɒv ðə trʌk/,ở phía sau xe tải,phrase,The boxes are in the back of the truck.,Từ vựng: Giao thông & Công trường
put gas in the car,/pʊt ɡæs ɪn ðə kɑːr/,đổ xăng vào xe hơi,phrase,I need to put gas in the car.,Từ vựng: Giao thông & Công trường
lamppost,/ˈlæmpˌpoʊst/,cột đèn,noun,The lamppost illuminated the street.,Từ vựng: Giao thông & Công trường
train track,/treɪn træk/,đường ray xe lửa,noun,The train runs on the train track.,Từ vựng: Giao thông & Công trường
be towed away,/bi toʊd əˈweɪ/,bị kéo đi,phrase,The illegally parked car was towed away.,Từ vựng: Giao thông & Công trường
be unoccupied,/bi ʌnˈɒkjʊpaɪd/,trống chỗ,phrase,The hotel room was unoccupied.,Từ vựng: Giao thông & Công trường
be tied up in the harbor,/bi taɪd ʌp ɪn ðə ˈhɑːrbər/,bị cột lại ở bến tàu,phrase,The ships were tied up in the harbor.,Từ vựng: Giao thông & Công trường
board the vehicle,/bɔːrd ðə ˈviːəkl/,lên xe,phrase,Please board the vehicle quickly.,Từ vựng: Giao thông & Công trường
near the platform,/nɪər ðə ˈplætfɔːrm/,gần thềm ga,phrase,Wait near the platform for the train.,Từ vựng: Giao thông & Công trường
dock,/dɒk/,bến tàu,noun,The boat is at the dock.,Từ vựng: Giao thông & Công trường
curb,/kɜːrb/,lề đường,noun,Park the car by the curb.,Từ vựng: Giao thông & Công trường
path,/pæθ/,"đường, lối đi",noun,Follow the path through the woods.,Từ vựng: Giao thông & Công trường
sweep,/swiːp/,quét dọn,verb,Sweep the floor clean.,Từ vựng: Giao thông & Công trường
climb a ladder,/klaɪm ə ˈlædər/,trèo lên thang,phrase,He will climb a ladder to reach the roof.,Từ vựng: Giao thông & Công trường
be renovated,/bi ˈrɛnəveɪtɪd/,được sửa chữa (tòa nhà),phrase,The old house is being renovated.,Từ vựng: Giao thông & Công trường
kneel in the garden,/niːl ɪn ðə ˈɡɑːrdən/,quỳ trong vườn,phrase,She likes to kneel in the garden and plant flowers.,Từ vựng: Giao thông & Công trường
push the wheelbarrow,/pʊʃ ðə ˈwiːlˌbæroʊ/,đẩy xe cút kít,phrase,He is pushing the wheelbarrow full of soil.,Từ vựng: Giao thông & Công trường
operate heavy machine,/ˈɒpəreɪt ˈhɛvi məˈʃiːn/,điều khiển máy móc hạng nặng,phrase,Only trained personnel can operate heavy machine.,Từ vựng: Giao thông & Công trường
